{
  "$schema": "https://json-schema.org/draft/2020-12/schema",
  "$id": "shesha-blueprint.schema.json",
  "title": "Shesha blueprint IR (machine twin)",
  "description": "The JSON twin of a screen blueprint. Comprehension emits it alongside the Markdown blueprint (fenced ```blueprint-json block); form-edit's compile-blueprint.js accepts ONLY this as build input — no spec, no build (L2).",
  "type": "object",
  "required": ["screen", "entity", "form", "archetype", "layout"],
  "properties": {
    "screen": { "type": "string", "description": "human screen name" },
    "entity": {
      "type": "object",
      "required": ["fullClassName"],
      "properties": {
        "fullClassName": { "type": "string", "description": "resolved entity type string (dataContext.entityType form)" },
        "modelType": {
          "type": "object",
          "description": "the {name, module} object for formSettings.modelType [R-016]",
          "properties": { "name": { "type": "string" }, "module": { "type": "string" } }
        }
      }
    },
    "form": {
      "type": "object",
      "required": ["module", "name"],
      "properties": { "module": { "type": "string" }, "name": { "type": "string" }, "label": { "type": "string" } }
    },
    "archetype": {
      "enum": ["record-detail", "hub", "list-card", "capture", "dashboard", "solution-map", "wizard", "inline-card", "table-worklist", "modal-dialog", "auth-page"],
      "description": "golden archetype to clone (assets/golden/_index.json keys)"
    },
    "theme": { "type": "string", "description": "theme token file name (e.g. 'shesha'); styling pass resolves it" },
    "fidelity": { "enum": ["A", "B", "C"] },
    "viewport": { "type": "string" },
    "layout": { "$ref": "#/$defs/node" },
    "bindings": {
      "type": "array",
      "items": {
        "type": "object",
        "required": ["property"],
        "properties": {
          "label": { "type": "string" },
          "property": { "type": "string", "description": "camelCase entity property or dotted nav path [R-004, R-034]" },
          "component": { "type": "string", "description": "explicit component type; omitted = by-datatype selection" },
          "datatype": { "type": "string" }
        }
      }
    },
    "assertions": {
      "type": "array",
      "description": "placement contract verified after build (stable properties, never pixels)",
      "items": {
        "type": "object",
        "required": ["id", "statement"],
        "properties": { "id": { "type": "string" }, "statement": { "type": "string" } }
      }
    }
  },
  "$defs": {
    "node": {
      "description": "A layout node — think of it as a React element. Compose the screen the way you would a React page: Stack/Row/Grid/Card for structure, Field/Text/Heading for content, Actions for buttons. The compiler maps each to the measured Shesha channel, so your flex/spacing/hierarchy instincts translate 1:1. See references/designing-like-react.md.",
      "type": "object",
      "required": ["kind"],
      "properties": {
        "kind": {
          "description": "layout | region: page root · stack: vertical flex · row: horizontal flex · grid: equal-width columns · card: surfaced panel · section: titled group · tabs/tab · field · text · heading · datatable · datalist · actions (Submit+exit buttonGroup) · chip. (container = alias of stack.)",
          "enum": ["region", "container", "stack", "row", "grid", "card", "section", "tabs", "tab", "datatable", "datalist", "field", "text", "heading", "buttonGroup", "actions", "chip"]
        },
        "name": { "type": "string" },
        "title": { "type": "string", "description": "card/section/tab heading, or a field's label override" },
        "width": { "type": "string", "description": "flex-child width — %, px, fr or calc(); compiled to desktop.dimensions.width (the ONLY split lever [R-028])" },
        "gap": { "description": "space between children — px number or scale token xs|sm|md|lg|xl|2xl; compiled to container gap", "type": ["string", "number"] },
        "padding": { "description": "inner padding — px number, scale token, or CSS shorthand; compiled to stylingBox", "type": ["string", "number"] },
        "align": { "enum": ["start", "center", "end", "stretch", "baseline"], "description": "cross-axis (alignItems)" },
        "justify": { "enum": ["start", "center", "end", "space-between", "space-around"], "description": "main-axis (justifyContent)" },
        "columns": { "description": "kind=grid: column count (number); kind=datatable: bound column properties (string[])", "type": ["integer", "array"], "items": { "type": "string" } },
        "level": { "description": "kind=heading: 1–4 (h1=page title … h4=label)", "type": "integer", "minimum": 1, "maximum": 4 },
        "property": { "type": "string", "description": "kind=field: the bound entity property (camelCase / dotted path)" },
        "component": { "type": "string", "description": "kind=field: explicit component type override (else by-datatype)" },
        "content": { "type": "string", "description": "kind=text/heading: literal content" },
        "itemForm": { "type": "string", "description": "kind=datalist: item card form name" },
        "children": { "type": "array", "items": { "$ref": "#/$defs/node" } }
      }
    }
  }
}
